{
  "$schema": "./contract.schema.json",
  "schemaVersion": 1,
  "contractId": "cpamp-v2-phase2-evidence-v1",
  "cpampBaselineCommit": "2850980d3d08fa30878744e1d67fc04607504c01",
  "capabilityStatuses": ["supported", "partial", "unsupported", "unknown", "requires_upstream"],
  "artifacts": [
    {
      "id": "current-bundled-v7-3-3",
      "classification": "current_bundled",
      "deploymentMode": "embedded",
      "versionKnown": true,
      "cpaVersion": "v7.3.3",
      "sourceTag": "refs/tags/v7.3.3",
      "sourceCommit": "7bbfeaf8a7acf2cd5a834dcb0842539fe6aabc2b",
      "pluginAvailability": "present",
      "releaseAssets": [
        {
          "id": "current-linux-amd64",
          "platform": "linux",
          "arch": "amd64",
          "assetName": "CLIProxyAPI_7.3.3_linux_amd64.tar.gz",
          "sha256": "7af8c99cd08eee3ccc81d1596e8a31785674d3de6bd7ec61416d59493dd8fc01",
          "size": 22204961
        },
        {
          "id": "current-linux-arm64",
          "platform": "linux",
          "arch": "arm64",
          "assetName": "CLIProxyAPI_7.3.3_linux_aarch64.tar.gz",
          "sha256": "5f320e3fae52af00f07b78201311e9d096b36e759441d948de48a10f49e71883",
          "size": 20017646
        }
      ]
    },
    {
      "id": "candidate-release-v7-3-8",
      "classification": "candidate_release",
      "deploymentMode": "release-artifact-fixture",
      "versionKnown": true,
      "cpaVersion": "v7.3.8",
      "sourceTag": "refs/tags/v7.3.8",
      "sourceCommit": "c93978c4ea2e908255a2a06c37599fda3651554a",
      "pluginAvailability": "present",
      "releaseAssets": [
        {
          "id": "candidate-linux-amd64",
          "platform": "linux",
          "arch": "amd64",
          "assetName": "CLIProxyAPI_7.3.8_linux_amd64.tar.gz",
          "sha256": "3fe5228c458624175d5e4e81d9dd003d82de688ca498fa368a790ea120bda0e3",
          "size": 22433536
        },
        {
          "id": "candidate-linux-arm64",
          "platform": "linux",
          "arch": "arm64",
          "assetName": "CLIProxyAPI_7.3.8_linux_aarch64.tar.gz",
          "sha256": "8d09ce286d857b2d0e6d77c39e08a755246120df58c02a115d58c391fc73e3f1",
          "size": 20224367
        }
      ]
    },
    {
      "id": "external-unnegotiated",
      "classification": "external",
      "deploymentMode": "external",
      "versionKnown": false,
      "cpaVersion": null,
      "sourceTag": null,
      "sourceCommit": null,
      "pluginAvailability": "unknown",
      "releaseAssets": []
    }
  ],
  "schedulerAcrossPrioritiesProvenance": {
    "commit": "b715526add0c452acc62062bf4fcef53897be604",
    "goField": "Capabilities.SchedulerAcrossPriorities",
    "rpcField": "scheduler_across_priorities",
    "default": false,
    "releaseAncestry": [
      {
        "version": "v7.3.3",
        "sourceCommit": "7bbfeaf8a7acf2cd5a834dcb0842539fe6aabc2b",
        "includesCommit": false
      },
      {
        "version": "v7.3.7",
        "sourceCommit": "b773607e3e7756dc6020a291825e4eb08899595a",
        "includesCommit": true
      },
      {
        "version": "v7.3.8",
        "sourceCommit": "c93978c4ea2e908255a2a06c37599fda3651554a",
        "includesCommit": true
      }
    ]
  },
  "sourceAnchors": [
    {
      "id": "client-access-auth",
      "repository": "cpa",
      "evidenceKind": "source",
      "path": "internal/api/server_middleware.go",
      "symbols": ["func accessAuthMiddleware", "manager.Authenticate", "c.Set(\"userApiKey\""],
      "versions": [
        {
          "artifactId": "current-bundled-v7-3-3",
          "sourceCommit": "7bbfeaf8a7acf2cd5a834dcb0842539fe6aabc2b"
        },
        {
          "artifactId": "candidate-release-v7-3-8",
          "sourceCommit": "c93978c4ea2e908255a2a06c37599fda3651554a"
        }
      ]
    },
    {
      "id": "client-config-api-key",
      "repository": "cpa",
      "evidenceKind": "source",
      "path": "internal/access/config_access/provider.go",
      "symbols": [
        "func (p *provider) Authenticate",
        "Principal: candidate.value",
        "Metadata: map[string]string"
      ],
      "versions": [
        {
          "artifactId": "current-bundled-v7-3-3",
          "sourceCommit": "7bbfeaf8a7acf2cd5a834dcb0842539fe6aabc2b"
        },
        {
          "artifactId": "candidate-release-v7-3-8",
          "sourceCommit": "c93978c4ea2e908255a2a06c37599fda3651554a"
        }
      ]
    },
    {
      "id": "frontend-auth-plugin-contract",
      "repository": "cpa",
      "evidenceKind": "source",
      "path": "sdk/pluginapi/types.go",
      "symbols": [
        "type FrontendAuthProvider interface",
        "Authenticate(context.Context, FrontendAuthRequest)",
        "type FrontendAuthResponse struct",
        "Authenticated bool",
        "Principal string"
      ],
      "versions": [
        {
          "artifactId": "current-bundled-v7-3-3",
          "sourceCommit": "7bbfeaf8a7acf2cd5a834dcb0842539fe6aabc2b"
        },
        {
          "artifactId": "candidate-release-v7-3-8",
          "sourceCommit": "c93978c4ea2e908255a2a06c37599fda3651554a"
        }
      ]
    },
    {
      "id": "plugin-abi-schema-v6",
      "repository": "cpa",
      "evidenceKind": "source",
      "path": "sdk/pluginabi/types.go",
      "symbols": ["SchemaVersion uint32 = 6"],
      "versions": [
        {
          "artifactId": "current-bundled-v7-3-3",
          "sourceCommit": "7bbfeaf8a7acf2cd5a834dcb0842539fe6aabc2b"
        },
        {
          "artifactId": "candidate-release-v7-3-8",
          "sourceCommit": "c93978c4ea2e908255a2a06c37599fda3651554a"
        }
      ]
    },
    {
      "id": "handler-request-model",
      "repository": "cpa",
      "evidenceKind": "source",
      "path": "sdk/api/handlers/handlers_execution.go",
      "symbols": [
        "func (h *BaseAPIHandler) executeWithAuthManagerFormats",
        "providersForExecution",
        "newRequestLifecycleTracker",
        "applyRequestInterceptorsBeforeAuth"
      ],
      "versions": [
        {
          "artifactId": "current-bundled-v7-3-3",
          "sourceCommit": "7bbfeaf8a7acf2cd5a834dcb0842539fe6aabc2b"
        },
        {
          "artifactId": "candidate-release-v7-3-8",
          "sourceCommit": "c93978c4ea2e908255a2a06c37599fda3651554a"
        }
      ]
    },
    {
      "id": "request-interceptor-contract",
      "repository": "cpa",
      "evidenceKind": "source",
      "path": "sdk/api/handlers/handlers_interceptors.go",
      "symbols": [
        "newRequestLifecycleTracker",
        "applyRequestInterceptorsBeforeAuth",
        "applyRequestInterceptorsAfterAuth",
        "requestLifecycleTracker) complete"
      ],
      "versions": [
        {
          "artifactId": "current-bundled-v7-3-3",
          "sourceCommit": "7bbfeaf8a7acf2cd5a834dcb0842539fe6aabc2b"
        },
        {
          "artifactId": "candidate-release-v7-3-8",
          "sourceCommit": "c93978c4ea2e908255a2a06c37599fda3651554a"
        }
      ]
    },
    {
      "id": "request-identity-metadata",
      "repository": "cpa",
      "evidenceKind": "source",
      "path": "sdk/cliproxy/executor/types.go",
      "symbols": [
        "PinnedAuthMetadataKey = \"pinned_auth_id\"",
        "SelectedAuthMetadataKey = \"selected_auth_id\"",
        "CallerScopeMetadataKey = \"caller_scope\"",
        "type RequestAfterAuthInterceptRequest struct"
      ],
      "versions": [
        {
          "artifactId": "current-bundled-v7-3-3",
          "sourceCommit": "7bbfeaf8a7acf2cd5a834dcb0842539fe6aabc2b"
        },
        {
          "artifactId": "candidate-release-v7-3-8",
          "sourceCommit": "c93978c4ea2e908255a2a06c37599fda3651554a"
        }
      ]
    },
    {
      "id": "candidate-filtering-selection",
      "repository": "cpa",
      "evidenceKind": "source",
      "path": "sdk/cliproxy/auth/conductor_selection.go",
      "symbols": [
        "availableAuthsForRouteModelWithPriorityMode",
        "availableAuthsForSelector",
        "pickViaPluginScheduler",
        "pickNext"
      ],
      "versions": [
        {
          "artifactId": "current-bundled-v7-3-3",
          "sourceCommit": "7bbfeaf8a7acf2cd5a834dcb0842539fe6aabc2b"
        },
        {
          "artifactId": "candidate-release-v7-3-8",
          "sourceCommit": "c93978c4ea2e908255a2a06c37599fda3651554a"
        }
      ]
    },
    {
      "id": "blocked-and-priority-semantics",
      "repository": "cpa",
      "evidenceKind": "source",
      "path": "sdk/cliproxy/auth/selector.go",
      "symbols": [
        "func highestPriorityAuths",
        "func isAuthBlockedForModel",
        "availableAuthsFromPriorityBuckets"
      ],
      "versions": [
        {
          "artifactId": "current-bundled-v7-3-3",
          "sourceCommit": "7bbfeaf8a7acf2cd5a834dcb0842539fe6aabc2b"
        },
        {
          "artifactId": "candidate-release-v7-3-8",
          "sourceCommit": "c93978c4ea2e908255a2a06c37599fda3651554a"
        }
      ]
    },
    {
      "id": "scheduler-plugin-boundary",
      "repository": "cpa",
      "evidenceKind": "source",
      "path": "internal/pluginhost/scheduler.go",
      "symbols": [
        "func (h *Host) PickAuth",
        "normalizeSchedulerResponse",
        "SchedulerWantsAcrossPriorities"
      ],
      "versions": [
        {
          "artifactId": "candidate-release-v7-3-8",
          "sourceCommit": "c93978c4ea2e908255a2a06c37599fda3651554a"
        }
      ]
    },
    {
      "id": "scheduler-plugin-v7-3-3",
      "repository": "cpa",
      "evidenceKind": "source",
      "path": "internal/pluginhost/scheduler.go",
      "symbols": ["func (h *Host) PickAuth", "normalizeSchedulerResponse"],
      "versions": [
        {
          "artifactId": "current-bundled-v7-3-3",
          "sourceCommit": "7bbfeaf8a7acf2cd5a834dcb0842539fe6aabc2b"
        }
      ]
    },
    {
      "id": "scheduler-capability-rpc",
      "repository": "cpa",
      "evidenceKind": "source",